"Lots of companies don't succeed over time. What do they fundamentally do wrong? They usually miss the future.",Larry Page
"Make it work, make it right, make it fast.",Kent Beck
"Make something people want.",Paul Graham
"May the Force be with you.",Multiple Characters (Star Wars)
"Measuring programming progress by lines of code is like measuring aircraft building progress by weight.",Bill Gates
"Mental toughness is the key to success at the highest level.",Steve Waugh
"Money and success don't change people; they merely amplify what is already there.",Will Smith
"Motivation is what gets you started. Habit is what keeps you going.",Jim Ryun
"Move fast and break things. Unless you are breaking stuff, you are not moving fast enough.",Mark Zuckerberg
"My mama always said life was like a box of chocolates. You never know what you're gonna get.",Forrest Gump
"Never give up. Never give in. Cricket is a game where anything can happen.",Shane Warne
"Never let the fear of striking out keep you from playing the game.",Babe Ruth
"Never tell me the odds.",Han Solo (Star Wars)
"Never underestimate the importance of fitness in modern cricket.",Clive Lloyd
"No amount of money ever bought a second of time.",Tony Stark (Avengers: Endgame)
"No matter what anybody tells you, words and ideas can change the world.",John Keating (Dead Poets Society)
"No one can make you feel inferior without your consent.",Eleanor Roosevelt
"Nobody puts Baby in a corner.",Johnny Castle (Dirty Dancing)
"Nothing beats the feeling of winning on the field of play.",Kapil Dev
"Nothing is impossible, the word itself says, 'I'm possible!'",Audrey Hepburn
"Oh yes, the past can hurt. But the way I see it, you can either run from it or learn from it.",Rafiki (The Lion King)
"One day the people that don't even believe in you will tell everyone how they met you.",Johnny Depp
"Only I can change my life. No one can do it for me.",Carol Burnett
"Only put off until tomorrow what you are willing to die having left undone.",Pablo Picasso
"Opportunities don't happen, you create them.",Chris Grosser
"Opportunities multiply as they are seized.",Sun Tzu
"Optimism is an occupational hazard of programming; feedback is the treatment.",Kent Beck
"Our deepest fear is not that we are inadequate. Our deepest fear is that we are powerful beyond measure.",Coach Carter (Coach Carter)
"Our industry does not respect tradition. It only respects innovation.",Satya Nadella
"Our lives are defined by opportunities, even the ones we miss.",Benjamin Button (The Curious Case of Benjamin Button)
"Our lives begin to end the day we become silent about things that matter.",Martin Luther King Jr.
"Pace is pace, yaar. You can't teach it.",Waqar Younis
"Patience is the key to success in Test cricket.",Glenn McGrath
"People often say that motivation doesn't last. Well, neither does bathing – that's why we recommend it daily.",Zig Ziglar
"People often say that motivation doesn't last. Well, neither does bathing.  That's why we recommend it daily.",Zig Ziglar
"People who are crazy enough to think they can change the world, are the ones who do.",Rob Siltanen
"Persistence is very important. You should not give up unless you are forced to give up.",Elon Musk
"Positive intent is what separates good teams from great teams.",Brendon McCullum
"Premature optimization is the root of all evil.",Donald Knuth
"Pressure is a privilege. Embrace it.",Ben Stokes
"Problems are not stop signs, they are guidelines.",Robert H. Schuller
"Programs are meant to be read by humans and only incidentally for computers to execute.",Donald Knuth
"Programs must be written for people to read, and only incidentally for machines to execute.",Harold Abelson
"Quality is more important than quantity. One home run is much better than two doubles.",Steve Jobs
"Records are there to be broken. I am not chasing records, I am trying to contribute to the team.",Brian Lara
"Remember no one can make you feel inferior without your consent.",Eleanor Roosevelt
"Remember that not getting what you want is sometimes a wonderful stroke of luck.",Dalai Lama
"Security is mostly a superstition. Life is either a daring adventure or nothing.",Helen Keller
"Self-belief and hard work will always earn you success.",Virat Kohli
"Simple things should be simple, complex things should be possible.",Alan Kay
"Simplicity is the soul of efficiency.",Austin Freeman
"Smart people learn from everything and everyone, average people from their experiences, stupid people already have all the answers.",Socrates
"Software is like sex: it's better when it's free.",Linus Torvalds
"Some people can't believe in themselves until someone else believes in them first.",Sean Maguire (Good Will Hunting)
"Some people dream of success, while other people get up every morning and make it happen.",Wayne Huizenga
"Some people want it to happen, some wish it would happen, others make it happen.",Michael Jordan
"Sometimes the right path is not the easiest one.",Grandmother Willow (Pocahontas)
"Sometimes you gotta run before you can walk.",Tony Stark (Iron Man)
"Start where you are. Use what you have.  Do what you can.",Arthur Ashe
"Stay humble, stay hungry, and keep learning.",Kane Williamson
"Stay hungry, stay foolish.",Steve Jobs
"Strength and honor.",Maximus (Gladiator)
"Strength does not come from winning. Your struggles develop your strengths.",Arnold Schwarzenegger
"Strive not to be a success, but rather to be of value.",Albert Einstein
"Stupid is as stupid does.",Forrest Gump
"Success is a journey, not a destination. You have to enjoy the process.",Harsha Bhogle
"Success is a lousy teacher. It seduces smart people into thinking they can't lose.",Bill Gates
"Success is liking yourself, liking what you do, and liking how you do it.",Maya Angelou
"Success is never final. You have to keep working to stay at the top.",Kumar Sangakkara
"Success is not a good teacher, failure makes you humble.",Shah Rukh Khan
"Success is not final, failure is not fatal: it is the courage to continue that counts.",Winston Churchill
"Success is not how high you have climbed, but how you make a positive difference to the world.",Roy T. Bennett
"Success is the sum of small efforts repeated day in and day out.",Robert Collier
"Success isn't always about greatness. It's about consistency.",Dwayne Johnson
"Success? I don't know what that word means. I'm happy. But success, that goes back to what in somebody's eyes success means. For me, success is inner peace. That's a good day for me.",Denzel Washington
"Take up one idea. Make that one idea your life - think of it, dream of it, live on that idea. Let the brain, muscles, nerves, every part of your body, be full of that idea, and just leave every other idea alone. This is the way to success.",Swami Vivekananda
"Talent is one thing, but the mental aspect of the game is equally important.",Imran Khan
"Talk is cheap. Show me the code.",Linus Torvalds
"Teach thy tongue to say, I do not know, and thous shalt progress.",Maimonides
"Technology is anything that wasn't around when you were born.",Alan Kay
"Technology is nothing. What's important is that you have a faith in people.",Steve Jobs
"Tell me and I forget. Teach me and I remember. Involve me and I learn.",Benjamin Franklin
"Testing leads to failure, and failure leads to understanding.",Burt Rutan
"That which does not kill us makes us stronger.",Friedrich Nietzsche
"That's been one of my mantras — focus and simplicity.",Steve Jobs
"That's my secret, Cap. I'm always angry.",Bruce Banner (The Avengers)
"The advance of technology is based on making it fit in so that you don't really even notice it.",Bill Gates
"The art of spin bowling is all about building pressure and then getting the breakthrough.",Shane Warne
"The battles that count aren't the ones for gold medals. The struggles within yourself – the invisible, inevitable battles inside all of us – that's where it's at.",Jesse Owens
"The battles that count aren't the ones for gold medals. The struggles within yourself—the invisible battles inside all of us—that's where it's at.",Jesse Owens
"The best dreams happen when you're awake.",Cherie Gilderbloom
"The best error message is the one that never shows up.",Thomas Fuchs
"The best performance improvement is the transition from the nonworking state to the working state.",John Ousterhout
"The best players are those who adapt to different conditions.",Mahela Jayawardene
"The best revenge is massive success.",Frank Sinatra
"The best teams have chemistry. They communicate with each other and they sacrifice personal glory for the common goal.",Harsha Bhogle
"The best teams play without fear.",Ben Stokes
"The best time to plant a tree was 20 years ago. The second best time is now.",Chinese Proverb
"The best way out is always through.",Robert Frost
"The best way to get a project done faster is to start sooner.",Jim Highsmith
"The best way to predict the future is to create it.",Alan Kay
"The best way to predict the future is to invent it.",Alan Kay
"The biggest risk is not taking any risk.",Mark Zuckerberg
"The computer was born to solve problems that did not exist before.",Bill Gates
"The day you think you have arrived, you have started to go downhill.",Ricky Ponting
"The difference between ordinary and extraordinary is that little extra.",Jimmy Johnson
"The distance between insanity and genius is measured only by success.",Bruce Feirstein
"The first rule of Fight Club is: You do not talk about Fight Club.",Tyler Durden (Fight Club)
"The first step is to establish that something is possible; then probability will occur.",Elon Musk
"The flower that blooms in adversity is the most rare and beautiful of all.",The Emperor (Mulan)
"The Force will be with you. Always.",Obi-Wan Kenobi (Star Wars)
"The function of good software is to make the complex appear to be simple.",Grady Booch
"The function of leadership is to produce more leaders, not more followers.",Ralph Nader
"The future belongs to those who believe in the beauty of their dreams.",Eleanor Roosevelt
"The game is about attitude and application.",Steve Waugh
"The game is not about individual brilliance alone. It's about how the team works together.",Harsha Bhogle
"The greatest thing you'll ever learn is just to love and be loved in return.",Christian (Moulin Rouge)
"The harder you work, the harder it is to surrender.",Brian Lara
"The harder you work, the luckier you become.",Jacques Kallis
"The harder you work, the luckier you get.",Sourav Ganguly
"The hardest choices require the strongest wills.",Thanos (Avengers: Infinity War)
"The journey of a thousand miles begins with one step.",Lao Tzu
"The key is to stay humble and hungry.",Kumar Sangakkara
"The key to reverse swing is practice and understanding the conditions.",Wasim Akram
"The key to success is consistency and hard work.",Anil Kumble
"The learn-it-all does better than the know-it-all.",Satya Nadella
"The man who has confidence in himself gains the confidence of others.",Hasidic Proverb
"The Matrix is everywhere. It is all around us.",Morpheus (The Matrix)
"The meaning of life is to find your gift. The purpose of life is to give it away.",Pablo Picasso
"The mind is everything. What you think you become.",Buddha
"The moment you give up is the moment you let someone else win.",Kobe Bryant
"The more you dream, the farther you get.",Michael Phelps
"The most common way people give up their power is by thinking they don't have any.",Alice Walker
"The most contrarian thing of all is not to oppose the crowd but to think for yourself.",Peter Thiel
"The most dangerous phrase in the language is, We've always done it this way.",Grace Hopper
"The most difficult thing is the decision to act, the rest is merely tenacity.",Amelia Earhart
"The most disastrous thing that you can ever learn is your first programming language.",Alan Kay
"The most important thing I've accomplished, other than building the compiler, is training young people.",Grace Hopper
"The most important thing in cricket is to be mentally strong.",Anil Kumble
"The most important thing is to be brave and take the game on.",Brendon McCullum
"The night is darkest just before the dawn.",Harvey Dent (The Dark Knight)
"The only impossible journey is the one you never begin.",Tony Robbins
"The only limit to our realization of tomorrow will be our doubts of today.",Franklin D. Roosevelt
"The only person you are destined to become is the person you decide to be.",Ralph Waldo Emerson
"The only thing standing between you and your goal is the story you keep telling yourself as to why you can't achieve it.",Jordan Belfort
"The only thing standing between you and your goal is the story you keep telling yourself as to why you can't achieve it.",Jordan Belfort (The Wolf of Wall Street)
"The only way to achieve the impossible is to believe it is possible.",Charles Kingsleigh
"The only way to do great work is to love what you do.",Steve Jobs
"The only way to go fast, is to go well.",Robert C. Martin
"The only way to learn to program is to write programs.",Paul Graham
"The only way to make sense out of change is to plunge into it, move with it, and join the dance.",Alan Watts
"The path from dreams to success does exist. May you have the vision to find it, the courage to get on to it, and the perseverance to follow it.",Kalpana Chawla
"The people who are crazy enough to think they can change the world are the ones who do.",Steve Jobs
"The person who says it cannot be done should not interrupt the person who is doing it.",Chinese Proverb
"The purpose of our lives is to be happy.",Dalai Lama
"The question I ask myself like almost every day is, Am I doing the most important thing I could be doing?",Mark Zuckerberg
"The question isn't who is going to let me; it's who is going to stop me.",Ayn Rand
"The real test is not whether you avoid this failure, because you won't. It's whether you let it harden or shame you into inaction, or whether you learn from it; whether you choose to persevere.",Barack Obama
"The secret of life is to fall seven times and to get up eight times.",Paulo Coelho (The Alchemist - adapted to film)
"The secret of success is to do the common thing uncommonly well.",John D. Rockefeller Jr.
"The successful warrior is the average man, with laser-like focus.",Bruce Lee
"The things you own end up owning you.",Tyler Durden (Fight Club)
"The two most important days in your life are the day you are born and the day you find out why.",Mark Twain
"The universe is not outside of you. Look inside yourself; everything that you want, you already are.",Rumi
"The way to get started is to quit talking and begin doing.",Walt Disney
"The worst thing I can be is the same as everybody else.",Arnold Schwarzenegger
"There are no traffic jams along the extra mile.",Roger Staubach
"There are only two hard things in Computer Science: cache invalidation and naming things.",Phil Karlton
"There is a difference between knowing the path and walking the path.",Morpheus (The Matrix)
"There is no elevator to success. You have to take the stairs.",Zig Ziglar
"There is no fate but what we make for ourselves.",John Connor (Terminator 2)
"There is no secret ingredient. It's just you.",Po (Kung Fu Panda)
"There is no spoon.",Spoon Boy (The Matrix)
"There is only one religion in the world - hard work.",Shah Rukh Khan
"There is only one way to avoid criticism: do nothing, say nothing, and be nothing.",Aristotle
"There's always something to work on, something to get better at.",Joe Root
"They may take our lives, but they'll never take our freedom!",William Wallace (Braveheart)
"Things may come to those who wait, but only the things left by those who hustle.",Abraham Lincoln
"Things work out best for those who make the best of how things work out.",John Wooden
"This is your life and it's ending one minute at a time.",Tyler Durden (Fight Club)
"To be a champion, you have to be willing to pay a greater price.",Steve Waugh
"To be successful you have to be selfish, or else you never achieve. And once you get to your highest level, then you have to be unselfish.",Michael Jordan
"To infinity and beyond!",Buzz Lightyear (Toy Story)
"To see the world, things dangerous to come to, to see behind walls, to draw closer, to find each other and to feel. That is the purpose of life.",Life Magazine Motto (The Secret Life of Walter Mitty)
"Too many of us are not living our dreams because we are living our fears.",Les Brown
"Too many people overvalue what they are not and undervalue what they are.",Malcolm S. Forbes
"Too many people spend money they haven't earned to buy things they don't want to impress people they don't like.",Will Smith
"Tough times don't last, tough people do.",Ricky Ponting
"Tough times never last but tough people do.",Robert H. Schuller
"Truth can only be found in one place: the code.",Robert C. Martin
"Try not to become a person of success, but rather try to become a person of value.",Albert Einstein
"Turn your wounds into wisdom.",Oprah Winfrey
"Twenty years from now you will be more disappointed by the things that you didn't do than by the ones you did do.",H. Jackson Brown Jr.
"Two roads diverged in a wood, and I—I took the one less traveled by, And that has made all the difference.",Robert Frost
"Two things are infinite: the universe and human stupidity; and I'm not sure about the universe.",Albert Einstein
"Understand that you own nothing. Everything that surrounds you is temporary. Only the love in your heart will last forever.",Leon Brown
"Walking on water and developing software from a specification are easy if both are frozen.",Edward V. Berard
"We always overestimate the change that will occur in the next two years and underestimate the change that will occur in the next ten.",Bill Gates
"We are stuck with technology when what we really want is just stuff that works.",Douglas Adams
"We are what we repeatedly do. Excellence, then, is not an act, but a habit.",Aristotle
"We become what we think about most of the time, and that's the strangest secret.",Earl Nightingale
"We become what we think about.",Earl Nightingale
"We can easily forgive a child who is afraid of the dark; the real tragedy of life is when men are afraid of the light.",Plato
"We can't help everyone, but everyone can help someone.",Ronald Reagan
"We don't read and write poetry because it's cute. We read and write poetry because we are members of the human race.",John Keating (Dead Poets Society)
"We generate fears while we sit. We overcome them by action.",Dr. Henry Link
"We may encounter many defeats but we must not be defeated.",Maya Angelou
"We must balance conspicuous consumption with conscious capitalism.",Kevin Kruse
"We must believe that we are gifted for something and that this thing must be attained.",Marie Curie
"We must believe that we are gifted for something, and that this thing must be attained.",Marie Curie
"We must ensure not only that everyone receives equal pay for equal work, but that they have the opportunity to do equal work.",Sheryl Sandberg
"We see our customers as invited guests to a party, and we are the hosts.",Jeff Bezos
"We're here to put a dent in the universe. Otherwise why else even be here?",Steve Jobs
"Well done is better than well said.",Benjamin Franklin
"What defines us is how well we rise after falling.",Mithali Raj
"What is the most resilient parasite? An idea.",Cobb (Inception)
"What lies behind us and what lies before us are tiny matters compared to what lies within us.",Ralph Waldo Emerson
"What seems to us as bitter trials are often blessings in disguise.",Oscar Wilde
"What valuable company is nobody building?",Peter Thiel
"What we do in life echoes in eternity.",Maximus (Gladiator)
"What we think, we become.",Buddha
"What you lack in talent can be made up with desire, hustle and giving 110% all the time.",Don Zimmer
"What's dangerous is not to evolve.",Jeff Bezos
"What's money? A man is a success if he gets up in the morning and goes to bed at night and in between does what he wants to do.",Bob Dylan
"What's the point of being alive if you don't at least try to do something remarkable.",John Green
"Whatever happens tomorrow, you must promise me one thing. That you will stay who you are, not a perfect soldier, but a good man.",Abraham Erskine (Captain America)
"Whatever you can do, or dream you can, begin it. Boldness has genius, power and magic in it.",Johann Wolfgang von Goethe
"When I let go of what I am, I become what I might be.",Lao Tzu
"When I stand before God at the end of my life, I would hope that I would not have a single bit of talent left and could say, I used everything you gave me.",Erma Bombeck
"When I was 5 years old, my mother always told me that happiness was the key to life.  When I went to school, they asked me what I wanted to be when I grew up.  I wrote down 'happy'.  They told me I didn't understand the assignment, and I told them they didn't understand life.",John Lennon
"When one door of happiness closes, another opens, but often we look so long at the closed door that we do not see the one that has been opened for us.",Helen Keller
"When one door of happiness closes, another opens.",Helen Keller
"When something is important enough, you do it even if the odds are not in your favor.",Elon Musk
"When to use iterative development? You should use iterative development only on projects that you want to succeed.",Martin Fowler
"When you cease to dream you cease to live.",Malcolm Forbes
"When you want to do something big, you have to be willing to take risks.",Elon Musk
"When you work with passion, nothing can stop you.",Aamir Khan
"Whenever you see a successful person, you only see the public glories, never the private sacrifices to reach them.",Vaibhav Shah
"Whether you think you can or think you can't, you're right.",Henry Ford
"Whether you think you can or you think you can't, you're right.",Henry Ford
"Why do we fall, sir? So that we can learn to pick ourselves up.",Alfred Pennyworth (Batman Begins)
"Why do we fall? So we can learn to pick ourselves back up.",Thomas Wayne (Batman Begins)
"Winning isn't everything, but wanting to win is.",Vince Lombardi
"Winning isn't everything, it's the only thing.",Vince Lombardi (Any Given Sunday)
"With great power comes great responsibility.",Uncle Ben (Spider-Man)
"Words are, in my not-so-humble opinion, our most inexhaustible source of magic.",Albus Dumbledore (Harry Potter)
"Work hard in silence, let your success be the noise.",Frank Ocean
"Yesterday is history, tomorrow is a mystery, but today is a gift. That is why it is called the present.",Master Oogway (Kung Fu Panda)
"You are never too old to set another goal or to dream a new dream.",C.S. Lewis
"You become what you believe.",Oprah Winfrey
"You can never cross the ocean until you have the courage to lose sight of the shore.",Christopher Columbus
"You can't always control what happens to you, but you can control how you respond.",Mithali Raj
"You can't climb the ladder of success with your hands in your pockets.",Arnold Schwarzenegger
"You can't fall if you don't climb.  But there's no joy in living your whole life on the ground.",Tom Hanks
"You can't just wake up and be a champion. It's a process.",Brian Lara
"You can't use up creativity.  The more you use, the more you have.",Maya Angelou
"You can't win matches by playing safe. You have to take risks.",Graeme Smith
"You can't worry too much about what people say. You've got to believe in your own ability.",Joe Root
"You don't become a great player overnight. It takes years of hard work and dedication.",Ricky Ponting
"You don't have to be great to start, but you have to start to be great.",Zig Ziglar
"You don't just show up and play. You have to work at it.",Rahul Dravid
"You don't need to be perfect, you just need to be better than the opposition.",Shane Warne
"You don't play for the crowd, you play for the country.",MS Dhoni
"You either die a hero or you live long enough to see yourself become the villain.",Harvey Dent (The Dark Knight)
"You have to be brave to win matches.",Ben Stokes
"You have to be mentally strong to succeed in international cricket.",Wasim Akram
"You have to be willing to be misunderstood if you're going to innovate.",Tim Cook
"You have to believe in yourself when no one else does. That's what makes you a winner.",Viv Richards
"You learn more from failure than from success. Don't let it stop you. Failure builds character.",Denzel Washington
"You learn more from your failures than from your successes.",Anil Kumble
"You learn something valuable from all of the significant events and people, but you never touch your true potential until you challenge yourself to go beyond imposed limitations.",Roy T. Bennett
"You may be disappointed if you fail, but you are doomed if you don't try.",Beverly Sills
"You miss 100% of the shots you don't take.",Wayne Gretzky
"You mustn't be afraid to dream a little bigger, darling.",Eames (Inception)
"You only live once, but if you do it right, once is enough.",Mae West
"You play the game with your heart, not with your bat.",Viv Richards
"You play to win, not to participate.",Jacques Kallis
"You take the red pill, you stay in Wonderland, and I show you how deep the rabbit hole goes.",Morpheus (The Matrix)
"You take your life in your own hands, and what happens? A terrible thing, no one to blame.",Erica Jong
"You want something, go get it. Period.",Chris Gardner (The Pursuit of Happyness)
"You'll have bad times, but it'll always wake you up to the good stuff you weren't paying attention to.",Sean Maguire (Good Will Hunting)
"You're gonna eat lightning and you're gonna crap thunder!",Mickey (Rocky)
"You're not your job. You're not how much money you have in the bank.",Tyler Durden (Fight Club)
"You've got to get up every morning with determination if you're going to go to bed with satisfaction.",George Lorimer
